,Description,Assignment group
0,job fail scheduler,4
1,job fail scheduler,1
2,circuit outage company usa plant bld carb access switch since,1
3,job fail scheduler,3
4,hello please usa access add shryresh rdyrty share mail box investor relation kindly needful,3
5,name language browser microsoft internet explorer customer number telephone summary need update ticket need resolve aerp,0
6,hostname disk volume space consume available,3
7,firewall warning software stop work,0
8,engineering tool work,0
9,please restore complete file hostname mitarbeiter azubis include file danke viele,3
10,unable log skype please advise,0
11,problem java,2
12,upload monthly report sid hana table zmc,4
13,hostname volume disk consume,3
14,erp sid password reset request,0
15,job fail scheduler,1
16,error message possible retrieve facet value start explore information space contain datum,4
17,nwfodmhc exurcwkm email internet browser importance high hello please help keep disconnect access week,0
18,happen every time try filter customer number bex hana use system primarily otc billing think issue regard client try filter copying pasting also import text file result idea fix error find log reference,4
19,setup new ewew,2
20,email query,0
21,hostname tool tax interface app average sample total cpu error threshold,3
22,hello system disk server hostname full please check virtual center,3
23,job hostname fail fail scheduler,1
24,fen essa presse box blinkt dauerhaft,2
25,hello follow staff need access stand history skv alicona kudhnyuhnm kesrgtyu rockehsty koiergyvh simekdty comparison beckshtywsnh beckshtyw,2
26,install hardcopy ewew,2
27,iphone crm app install,0
28,hallo ich chte gerne das der suche auch meine telefon erscheint,2
29,monitor tauschen,2
30,interface switch company deu germany emsw access since,1
31,job bwhrattr fail scheduler,4
32,monitor disk fail localhost outside expect limit true,1
33,job fail scheduler,4
34,hostname volume label dat deb server space consume available,3
35,guten morgen dhthykts die kamera den neuen monitor anzuschlie ben tigen wir ein kabel von hdmi auf diesen hellgrauen anschluss dell ist zumindest erste aufgebaut fall andere alternativen gibt sind nat rlich auch daf offen,2
36,lean tracker opening,0
37,keyboard break eewhse,2
38,access time recording network,2
39,job hostname fail fail scheduler,1
40,please unlock erp account user murakt,0
41,job sid arc fail scheduler,1
42,job fail scheduler,4
43,job fail scheduler,4
44,"hello mr . dwfiykeo argentxmvcumar help team , please synchronize two network , must identical , datum currently correct , many thank advance , sincerely , mafghyrina ntner specialist share service company gmbh gesch ftsf hrer",3
45,abende job scheduler,4
46,job sid hoti fail scheduler,1
47,lhqsm fim production miiserver exe wrong number instance process expect gte find time e,3
48,job fail scheduler,4
49,telephony software configure,0
50,problem computer remain ngen,2
51,ticket update inplant,0
52,job fail scheduler,4
53,monitor video messmaschine liefern oziflwma nhgvmqdl,2
54,job fail scheduler,4
55,job fail scheduler,1
56,provide access hnynhsth jsuyhwssad user pragtyhusas network folder hostname transition infrastructure security operation,3
57,job fail scheduler,1
58,gso please unlock erp sid linz,0
59,reset ess password,0
60,laserjet copier show error message transfer unit miss,2
61,job fail scheduler,4
62,type outage network circuit power please specify top cert site yes start schedule maintenance company provider maint ticket backup active contact notify phone email remote dial equipment reset verify work vendor global telecom verizon gsc start additional diagnostic,1
63,wiksufty jimdghty manager believe user need change zazrtuld carmer craigfgh cardfrmeca please confirm change wilsfgtjl povich trtgoy mgr povictcfgt current andrdgrtew mohnrysu mapping mondhrbaz johthryu marftgytin magtyrtijc,4
64,job fail scheduler,4
65,job sid filesys fail scheduler,1
66,ebhsm volume label dat dcc server space consume available,3
67,problem lan computer eroding machine,2
68,job fail scheduler,1
69,job fail scheduler,1
70,job fail scheduler,1
71,able switch tape week,3
72,job fail scheduler,4
73,map network drive,0
74,job bwhrertran fail scheduler,4
75,ticket update inplant,0
76,consultant unable login citrix attach error screenshot kindly needful,3
77,job sid arc fail scheduler,1
78,please provide read write access frseoupk feluybrn karghytuthik follow network folder hostname grinding,3
79,job fail scheduler,4
80,job fail scheduler,4
81,problem erpgui,2
82,account lock password reset,0
83,hostname average sample disk free,3
84,trigger load fill rate recovery kba,4
85,job fail scheduler,1
86,type outage network circuit power please specify top cert site yes start edt schedule maintenance company provider maint ticket backup active contact notify phone email remote dial equipment reset verify work vendor global telecom verizon gsc start additional diagnostic,1
87,hello datum dierppeare bex productmanagement master find reason anybody change key figure name sale revenue total addition new net value nobody inform change different content two figure immediately need back report work well,4
88,support calculator measure device,2
89,early start chat rakthyesh pull report though hana select analysis tab refresh thing go display need filter template add plant would select box empty see attach something ask close reopen reopen go able refresh filter fix still try white see long show hit could spreadsheet say ticket copy buy need run send email go back chance problem please correct customer service supervisor cec infrastructure,4
90,please restore weste hostname file operational rule facility bonus docx thank much good,3
91,problem print measure machine,2
92,unable make receive call skype times warehouse tool thru hehr toolhone audible hear speake,0
93,apusm volume label dat hostname deb space consume available,3
94,wireless access point work,2
95,job fail scheduler,4
96,abende job scheduler,4
97,job fail scheduler,1
98,vip unable access collaboration platform,0
99,ticket update,0
100,outage erp sid,0
101,job fail scheduler,4
102,unlocked account todd able get successfully,0
103,mouse break,2
104,report working show datum laurent open within report tool browser link use follow site certify content view dailyorderbillingreport mtd ctry iid output per attach,4
105,job fail scheduler,4
106,abende job scheduler,4
107,internal error unable find process probe fail start command exe insufficient system resource exist complete requested service,3
108,apac company two switch since chn access,1
109,hostname kisp iis app server production disk free warning threshold,3
110,job bkwin hostname inc fail scheduler,1
111,sandir usa interface since,1
112,job fail scheduler,1
113,reboot serverteam thinclient able connect rds server hostname,3
114,backup statistic session queue time hour complete disk agent fail abort total medium mbyte use agent error job scheduler,1
115,job fail scheduler,1
116,summary need acce run bex report show margin access also erp business object load onto machine however work get follow message launcher exit error see log file detail analysis add register correctly,4
117,ftp error put zmm bestand stl dat job fail scheduler,1
118,dear please fix bobj problem see error message,4
119,need erp password reset,0
120,access report report tool however none lookup sort feature available field upper right corner allow manipulate show blank screen shot please refer attachment,4
121,windows account lock,0
122,job fail scheduler,4
123,please unlock user vvamrtryot environment sid seem still lock everything fine,0
124,abende job scheduler,4
125,hostname volume space consume available,3
126,unable access company password expire,0
127,msoffice installation,0
128,able login beyond evolution campaign report engineering tool site certify content,4
129,type outage network circuit power please specify top cert site yes start schedule maintenance company provider maint ticket backup active contact notify phone email remote dial equipment reset verify work vendor global telecom verizon gsc start additional diagnostic,1
130,job fail scheduler,4
131,error window can not access hostname red cross drives server user work contact impact quote team design manufacture usa plant,3
132,hostname tool tax interface app total cpu error threshold,3
133,ebhsm volume consume,3
134,abend batch job,4
135,optiplex messmachine berirtch zedghkler,3
136,job fail scheduler,4
137,type outage network circuit power please specify top cert site yes start schedule maintenance company provider maint ticket backup active contact notify phone email remote dial equipment reset verify work vendor global telecom verizon gsc start additional diagnostic,1
138,job hana sid dly fail scheduler,1
139,hello want connect workstation printer germany follow screen shot say need permission system administrator many,0
140,source system name hostname new destination lmxl device username ztnfhiwq njpwxmdi iba location mexico sms status update field sale user yes dsw event log see datum relate event summary internal outbreak tcp time att singapore asa company com extra inspectorruleid sherlockruleid cvss ontologyid srchostname eventtypeid dsthostname ctainstanceid irreceivedtime inspectoreventid proto eventtypepriority dstport action block ileatdatacenter true foreseemaliciouscomment null empty model find evaluationmodel ngm foreseeinternalip logtimestamp agentid foreseeconndirection srcassetofinterest srcport occurrence count detail deny src inside dst outside access group acl,3
141,entire location germany network user mention application erp outlook internet intranet,1
142,usa access configure outlook exchange windows phone,0
143,dear sir sufficient space follow drive server request enhance storage capacity mtbu ele hostname file eplan vault,3
144,node ldiwsf locate usa village since,1
145,abende job scheduler sid arc,1
146,ldism usa village claapdico robot inactive since,1
147,job fail scheduler,4
148,unable submit discount form,0
149,job fail scheduler,4
150,type outage network circuit power please specify top cert site yes start schedule maintenance company provider maint ticket backup active contact notify phone email remote dial equipment reset verify work vendor global telecom verizon gsc start additional diagnostic,1
151,company guest account set,0
152,hello unlock password please user block set welcome,2
153,type outage network circuit power please specify top cert site yes start schedule maintenance company provider maint ticket backup active contact notify phone email remote dial equipment reset verify work vendor global telecom verizon gsc start additional diagnostic,1
154,mys ptmjvysi vkrepcybwa please confirm change wilsfgtjl mikhghytr rushethryli talryhtir michghytuael tayloml current manager andrdgrtew mohnrysu need mapping mondhrbaz,4
155,cksetzung der passw rter account vvwtyeidt vvftgors vvnergtubj vvthygschj,0
156,login issue verify user detail employee manager name check unlocked account advise check caller confirm able resolve,0
157,job tool netch keheu fail scheduler,1
158,job fail scheduler,4
159,job fail scheduler,4
160,abende job scheduler,4
161,unable login erp sid,0
162,barcode scanner defect paternoster,2
163,job fail scheduler,1
164,probleme mit tool,2
165,erp sid password reset,0
166,job bkbackup tool report prod full fail scheduler,1
167,abende job scheduler,4
168,hello team write request change date couple citrix user eastern time usandcanada eet european changed vrtvpopc vvrnrtacri vvrtgffada vvrurtgsur vvrtyjakaa vvrtymitrd vvdeftmea vvbgrtyeleb vvcodgtjud vvggrthhibg could please kind perform change let know additional information require side,3
169,hello system disk server hostname full please check issue week ago ticket inc identify solve cause problem impact virtual center,3
170,amssm volume disk space consume available,3
171,nwfodmhc exurcwkm tiyhum kuyiomar request reset microsoft online service password rodny please change,0
172,type outage network circuit power please specify top cert site yes start schedule maintenance company provider maint ticket backup active contact notify phone email remote dial equipment reset verify work vendor global telecom verizon gsc start additional diagnostic,1
173,hostname transition application portal java web training full access guprgtta,3
174,job bwdpmbkp fail scheduler,4
175,problem wifi laptop,2
176,job fail scheduler,4
177,name maaryuyten language browser microsoft internet explorer customer number telephone summary bobj acce welcome next available agent shortly interaction alert website visitor join conversation log error message get dwfiykeo argtxmvcumar hello well understand issue would like take look computer teamviewer please click sre still yes see issie let screen shoot assign erp,4
178,hello need help aerp outlook stop work,0
179,abende job scheduler,4
180,windows account lock,0
181,setup,2
182,name language browser microsoft internet explorer customer number summary itry open excel file online work,0
183,job fail scheduler,4
184,hostname robot inactive average sample swap memory usage error threshold internal unable find process probe fail start command exe insufficient system resource exist complete requested service,3
185,problem computer ewewx,2
186,unable launch outlook,0
187,install pdfmailer,2
188,erp sid account lock,0
189,login issue verify user detail employee manager name check unlocked account advise check caller confirm able resolve,0
190,problem erpgui,2
191,unable log supply chain software,0
192,hello assign read write authorisation guru prasath user prarttsagj folder iso sid warm,3
193,type outage network circuit power please specify top cert site yes start schedule maintenance company provider maint ticket backup active contact notify phone email remote dial equipment reset verify work vendor global telecom verizon gsc start additional diagnostic,1
194,monthly reboot hostname chkdsk run around currently verify file stage percent complete,3
195,moin marfhtyio please mr lzuwmhpr riuheqsg allow drive department hostname distribution form thank kind,3
196,defect pain bath bluetooth,2
197,hostname windows disk space utilization alert utiliuytretion free available,3
198,problem shift planning,2
199,please unlock sebfghkasthian account wirftejas,0
200,"access mail account via iphone block entire account , must delete re - create",2
201,can not access hostname engineering application vpn company use vvbloor inc close fix please assign vidya computer lbdl sign ons dudekm sign onto work use work sign vvblorytor server,3
202,information ngprt printer name,0
203,job fail scheduler,4
204,uacyltoe hxgaycze,3
205,job fail scheduler,1
206,erp print tool install,0
207,abende job scheduler hana sid erp dly,1
208,install zebra,2
209,dear sir please provide access application company engineering tool business client,0
210,daghyunny send deployment notification last week target list schedule morning please find attached email copy reference would concern,0
211,hello refer screen shoot error warm,0
212,access department abstech eemw database betap profile betapdachform betapfassen contact sudghnthdra,3
213,job fail scheduler,4
214,job fail scheduler,1
215,identify unavailable via esrs monitor service connectivity,3
216,abende job scheduler bwhrattr,4
217,job biaprod fail scheduler,1
218,picture book exchange printer,2
219,pobleme mit combi,2
220,job sid filesys fail scheduler,1
221,job tool netch fail scheduler,1
222,machine roanoke change user login roaghyunokepc full access please add lrrsm department aerp production plant controller,3
223,interface fastethernet cisco aircap company usa idf access com since,1
224,detail provide try open file state corrupt can not open multiple file notice since plant become unavailable confirmation different department mail notice regard possible server change,3
225,job fail scheduler,1
226,light back one file server site blink part plant access network resource please help check local hostname lrrsm contact,3
227,job fail scheduler,4
228,setup new instandsetzung,2
229,problem portal,2
230,account unlock,0
231,computer optiplex defective ewew,2
232,job fail scheduler,1
233,job fail scheduler,4
234,job fail scheduler,4
235,password reset request,0
236,backup tool lhqsm take hour release snapshot end look advise problem,3
237,can not see new fax public amssm ricoh folder since end could please check fix problem,3
238,canner metroligic calculator defective zedlet,2
239,computer ewewx olympus access hostname tool equal,2
240,erp sid zdsxmcwu thdjzolwronization issue,0
241,see attached workbook require refresh msc requirement,4
242,restart service lhqsid server phone,3
243,dob report site certify content view dailyorderbillingreport day iid need subscribe option can not see screen,4
244,job fail scheduler,1
245,job fail scheduler,3
246,"hello help reset database mark plan stock report daily xlsx thank process planning company produktion gmbh manage director jofghyuach fabry communication sole use addressee may contain information copyright worthy confidential exempt disclosure permit applicable law , dissemination , distribution reproduction person intend recipient strictly prohibit receive mistake please notify sender notice post select follow link view disclaimer alternate language",2
247,setup new computer old forge,2
248,job sid arc fail scheduler,1
249,job fail scheduler,4
250,type outage network circuit power please specify top cert site yes start schedule maintenance company provider maint ticket backup active contact notify phone email remote dial equipment reset verify work vendor global telecom verizon gsc start additional diagnostic,1
251,hai reset password login kind,0
252,job fail scheduler,4
253,email spam query,0
254,ticket employment status new non employee enter user name,0
255,job fail scheduler,4
256,unable sign skype,0
257,job fail scheduler,4
258,install ewew,2
259,abende job scheduler,4
260,job bwhrattr fail scheduler,4
261,node hostname locate germany since,3
262,user virakv ping hostname ping company com bytes datum request time statistic packet sent receive lose loss,3
263,incident overview detect least occurrence firewall company internal asa com drop traffic source hostname destine port one destination device activity indicate follow infection host misconfigure scan authorize unauthorized escalate via high priority ticket phone call per default event handling procedure would like handle incident differently future see option question concern please let know either correspond delegate back soc call escalation alert block explicit notification medium automatically resolve portal event available reporting purpose sincerely securework technical detail historically various worm malware use port propagate example include blaster worm msblast lovsan welchia nachi reatle microsoft epmap end point mapper also know dce rpc locator service netbio name datagramdnty session smb file share additional information good practice find site reference datum relate summary outbreak tcp occurrence count connection source apusm directionality protocol device log time utc action cvss score scwx processing sherlock rule sle inspector ontology type agent detail inbound deny flag syn interface inside,3
264,skype load phone problem last week,0
265,lhbsm disk free warning threshold,3
266,abende job scheduler,4
267,mscrm outlook open connect user system use teamviewer reconfigured profile launch caller confirm able see email issue resolve,0
268,access point defekt,2
269,able click icon login citrix please refer screenshot,3
270,job bkwin search server daily fail scheduler,1
271,setup tool,2
272,type outage network circuit power please specify top cert site yes start schedule maintenance company provider maint ticket backup active contact notify phone email remote dial equipment reset verify work vendor global telecom verizon gsc start additional diagnostic,1
273,abende job scheduler,4
274,node lhqsm locate usa since,3
275,model field publish otc quotes zcae quote performance value raw doc curr see round see attach screenshot convert usd sample currency document two field match,4
276,calculator ngen measure machine uacyltoe hxgayczeen,2
277,install pulverleitstand,2
278,error can not authenticate user soap fault detail endpoint connection available hostname company com fail create nfc download stream path job scheduler,1
279,job fail scheduler,1
280,abende job scheduler sid cold,1
281,job fail scheduler,4
282,please release skv alicona,3
283,windows account lock,0
284,"sincerely , good",0
285,data backup und restore,2
286,back tape eject today unable switch tape previously switch daily,3
287,please take snapshot vms manually hostname,3
288,job fail scheduler,4
289,rqxmaindept account keep getting lock please unlock,3
290,job fail scheduler,1
291,type outage network circuit power please specify top cert site yes start schedule maintenance company provider maint ticket backup active contact notify phone email remote dial equipment reset verify work vendor global telecom verizon gsc start additional diagnostic,1
292,hello need access quality folder lan drive usa,3
293,setup ewewx,2
294,job fail scheduler,4
295,type outage network circuit power please specify top cert site yes start schedule maintenance company provider maint ticket backup active contact notify phone email remote dial equipment reset verify work vendor global telecom verizon gsc start additional diagnostic,1
296,install tool und zebra ewew,2
297,apac company chn access,1
298,hello business decision recently make view mfg tooltion customer classification indirect sale go forward currently bex system classify direct please modify cust grp enhance field zcustgrp show customer use several hana report plan product management otc billing etc let know question well,4
299,type outage network circuit power please specify top cert site yes start schedule maintenance company provider maint ticket backup active contact notify phone email remote dial equipment reset verify work vendor global telecom verizon gsc start additional diagnostic,1
300,type outage network circuit power please specify top cert site yes start schedule maintenance company provider maint ticket backup active contact notify phone email remote dial equipment reset verify work vendor global telecom verizon gsc start additional diagnostic,1
301,hell next issue bob work account well,4
302,change password yesterday ever since keep get message enter email nothing happen get prompt one note sync issue evry time work file prompt,0
303,job bkbackup tool sql prod inc fail scheduler,1
304,dear sir laptop currently version microsoft outlook kindly help get lauacyltoe hxgaycze well,0
305,reinstall tool ewew,2
306,job fail scheduler,4
307,wesley tomlin wilsfgtjl verboncouer markhty verboma current manager need change mapping chefgtnp mason bengtjamin masonb,4
308,type outage network circuit power please specify top cert site yes start schedule maintenance company provider maint ticket backup active contact notify phone email remote dial equipment reset verify work vendor global telecom verizon gsc start additional diagnostic,1
309,logon server hostname possible loop welcome screen,3
310,plant server hostname lrrsm connect see gtehdnyu light front server blink,3
311,skype personal certificate issue,0
312,type outage network circuit power please specify top cert site yes start schedule maintenance company provider maint ticket backup active contact notify phone email remote dial equipment reset verify work vendor global telecom verizon gsc start additional diagnostic,1
313,setup new,2
314,erp net weaver work empw,0
315,lhqsm kas hfyujqti jdcbiezx average sample disk free warning threshold total size,3
316,job fail scheduler,4
317,job fail scheduler,1
318,inquiry employee shesyhur posrt,0
319,user unable connect network drive hostname server also reachable,3
320,lhqwsf usa nologin collaboration platform script return unexpected value,1
321,setup new,2
322,erp sid account lock,0
323,job hana sid erp dly fail scheduler,1
324,can not open item text formatheywting command available,0
325,interface fastethernet router embertell company bra sao pollaurido switch access com since,1
326,job bkbackup tool powder prod full fail scheduler,1
327,job fail scheduler,4
328,problem printer local,2
329,externe festplatte verf gung stellen alte nobook,2
330,job fail scheduler,4
331,unable login hostname vsphere client vmware virtualcenter server service stop state,3
332,unable open outlook change password,0
333,connection workstation server uxhq normal printing work unable print label fine win system issue printer wezeb barcode,2
334,problem print salary statement,2
335,gigabitethernet shopfloor schuette company deu germany emsw access since,1
336,update ticket,0
337,support thrydsss funke,2
338,reinstall office,2
339,service kit liefern,2
340,good morning request access file,3
341,computer viotto work,2
342,hello team could please support mdm issue via citrix application datum manager import work try upload catalog find error print screen attach,3
343,company email personal smartphone,0
344,one spam mail please check,0
345,hello please install lauacyltoe hxgaycze version flash player system get message show try complete ethic course collaboration platform site,0
346,type outage network circuit power please specify top cert site yes start schedule maintenance company provider maint ticket backup active contact notify phone email remote dial equipment reset verify work vendor global telecom verizon gsc start additional diagnostic,1
347,job fail scheduler,4
348,windows password reset,0
349,problem drive,2
350,aetwpiox eijzadco unable login ess portal please reset password send new manager shynhjundar emp name useid vvttraja,0
351,brauche freigabe skv alicona,3
352,please set release skv alicona,3
