,Description,Assignment group
733,erp sid password reset,0
734,able apply job company portal external user,0
735,job fail scheduler,4
736,job fail scheduler,4
737,job fail scheduler,1
738,problem lan ewew,2
739,job fail scheduler,4
740,problem outlook,2
741,please provide access mtb sale drive clarification call back well,3
742,difficulty obtain datum bobj must morning issue report could someone please call,4
743,account unlock,0
744,unable connect network drive vpn,0
745,setup computer information stand repair,2
746,job bkbackup tool powder prod full fail scheduler,1
747,average sample disk free warning threshold total size,3
748,job bwhrertran fail scheduler,4
749,receive email inin try ping server respond media disconnect company inc cthaasnoc network operations center noc alert via proactive monitoring follow open incident track close connectivity establish please verify power device follow provider troubleshooting affect infrastructure dengic location united states indgic additional information trghwyng route lpapr maximum hop sartlgeo lhqksbdx request time question regard notification contact support team number list sincerely interactive intelligence blast mailbox monitor call phone communication,1
750,type outage network circuit power please specify top cert site yes start est schedule maintenance company provider maint ticket backup active contact notify phone email remote dial equipment reset verify work vendor global telecom verizon swisscom gsc start naa additional diagnostic,1
751,unable login erp please needful,0
752,please provide permission file department networking,3
753,problem portal,2
754,job fail scheduler,4
755,job fail scheduler,4
756,try add change item get error list knethyen grechduy engineer product engineering company inc technology way usa www com,0
757,job fail scheduler,4
758,volume label sys lhqsm server space consume available,3
759,everytime want set filter report tool datum source publish otc billing get error message,4
760,robot lhqwsf usa inactive since,1
761,windows account lock,0
762,hello help please restore excel file drill catalog home drive solid carbide drill eagclhome martif yesterday,3
763,probleme mit collaboration platform infopath,2
764,location access database roll information currently need interrupt data entry extract project also stop calculate density number fix limited experience help problem look like path lan contact,3
765,help change windows password use management tool connect user system teamviewer login manager password sync pssword company network caller confirm able issue resolve,0
766,job fail scheduler,1
767,dear team good morning please provide full control access path member markhtye department hostname file scorecard india iscl update sagfhoshgzpkmilu skwbuvjyheelavant fahdlecz erathyur culixwse pmrvxbnjhivaramdntyaiah,3
768,able get outlook keep get message tell stop work want restart safe mode repair send phone,0
769,job fail scheduler,4
770,problem outlook,2
771,sinic general error odbc vmsliazh ltksxmyv driver query timeout,2
772,job bkwin cluster full fail scheduler,1
773,abende job scheduler,4
774,job fail scheduler,4
775,contract management employee publication,4
776,barcode scanner defect paternoster bur orde,2
777,backup statistic session queue time hour complete disk agent fail abort total medium mbyte use agent error job bkwin hostname inc scheduler,1
778,jayatramdntydba cvyg nwfodmhc exurcwkm bhayhtrathramdnty mamilujli amihtar lalthy ticket new non employee gurublxkizmh nvodbrfluppasadabasavaraj vvkuthyrppg hello guruythupyhtyad still able open folder mtb project mgmt servicing please look subject provide access well,3
779,reinstall tool und hardcopy,2
780,india company ind kirty lean stack go gigabitethernet uplink access com,1
781,problem laser,2
782,job sid arc fail scheduler,1
783,hostname average sample disk free warning threshold total size,3
784,hello need new decent mouse hre sch bring we short notice nnuacyltoe hxgaycze,2
785,pick old equipment,2
786,dear someone please check new sale employee name show plan actual bobj report let know also see name people automatic routine,4
787,job fail scheduler,4
788,job conf fail scheduler,4
789,probleme mit portal user gogtyekthyto,2
790,setup new,2
791,job fail scheduler,1
792,type outage network circuit power please specify top cert site yes start schedule maintenance company provider maint ticket backup active contact notify phone email remote dial equipment reset verify work vendor global telecom verizon gsc start additional diagnostic,1
793,please restore personal drive adelhmk soon possible unavailable server migration,3
794,provide access folder right hostname mtdesign company machine manual file well,3
795,access bobj,4
796,current file corrupt working server name dat hostname,3
797,usa file server responding appear crash,3
798,password logon long possible many fail attempt,0
799,problem ewew,2
800,setup new,2
801,hello can not login sid anymore see attachment please fix user hannas meixni,0
802,abende job scheduler,4
803,hostname label dat deb server space consume available,3
804,vivbhuek kanjdye nwfodmhc exurcwkm action require please connect new vpn url get follow message system warning clear javascript instal warn full functionality enable browser otherwise feature especially relate web application window work correctly cache clean fail popup blocker cause fail use blocker see outdated page form well disable policy restriction access network resource company deny engine reason anti virus trust,0
805,abende job scheduler,1
806,hello team abdhtyu account lock could please check,0
807,account lock,0
808,hostname average sample disk free warning threshold total size,3
809,job sid filesys fail scheduler,1
810,job tool netch fail scheduler,1
811,hard disk failure esxi host atjsv,3
812,incident past two day can not access email collaboration platform fix issue occur,0
813,hpqc uacyltoe hxgaycze installation,0
814,usa plant company bld carb access switch since,1
815,job fail scheduler,4
816,job fail scheduler,4
817,database can not open yet previously restart,3
818,ewew optiplex lager darda,2
819,reinstall hardcopy und tool,2
820,device run dell tape library backup error say open door,3
821,install drucker oziflwma nhgvmqdl,2
822,erp sid password reset,0
823,job snp heu regen fail scheduler,1
824,please provide access follow akirtyethsyd user vvsthryomaa aswyuysm mtbelengineere toolical production file read write hostname mtbu ele printer,3
825,defective fiber optic cable box,2
826,blue screen error,0
827,hello help put ticket access quality assurance drive employee username whalep aerp copy owner eozqgim rbmosifh manager permission reason,3
828,windows disk space utilization alert lhbsm,3
829,volume label dat hostname server space consume available,3
830,reboot lhqsm patent web uacyltoe hxgaycze server,1
831,password reset request,0
832,please give full access user trhadg folder mention subject,3
833,type outage network circuit power please specify top cert site yes start schedule maintenance company provider maint ticket backup active contact notify phone email noi remote dial equipment reset verify work vendor global telecom verizon gsc start additional diagnostic,1
834,setup new,2
835,monitor tauschen,2
836,job fail scheduler,4
837,report tool alert average sample disk free warning threshold total size,4
838,source system name hostname santiago south amerirtca backup exec server user uidgt olibercsu olvidley location sm status see field sale yes dsw event log content version fmxcnwpu tcwrdqboinition version sequence host integrity available reputation setting portal list intrusion prevention signature power eraser definition revocation engine sonar extended file attribute signature symantec permit application incident overview detect least occurrence firewall company internal asa com drop traffic source destine port one destination device activity indicate follow infection misconfigured scan authorize unauthorized escalate via high priority ticket phone call per default handling procedure would like handle incident differently future option question concern please let know either correspond delegate back soc call escalation alert block explicit notification medium automatically resolve event report purpose sincerely dell secureworks technical detail historically various worm malware use port propagate example include blaster worm msblast lovsan welchia nachi reatle microsoft epmap end point mapper also know dce rpc locator service netbio datagramdnty session smb share additional information good practice find site reference datum relate summary outbreak tcp time device extra inspectorruleid sherlockruleid cvss ontologyid srchostname eventtypeid ctainstanceid foreseeglobalmodelassessmt unknown irreceivedtime foreseemalprobglobalmodel inspectoreventid eventtypepriority proto dstport action ileatdatacenter true foreseemaliciouscomment globalmodelversion null empty model foreseeinternalip logtimestamp agentid foreseeconndirection srcassetofinterest srcport occurrence count detail inbound connection deny flag syn interface inside deny src dst outside access group acl xedbf sartlgeo lhqksbdx xacbc,3
839,can not launch add lean event icon collaboration platform request install microsoft version attach error reference,0
840,type outage network circuit power please specify top cert site slo yes start schedule maintenance company provider maint ticket backup active contact notify phone email remote dial equipment reset verify work vendor global telecom verizon gsc start additional diagnostic,1
841,dear team please usa read write access follow two folder dnqdqld hostname department personal file pesonal,3
842,setup ewew,2
843,hello issue outlook view call let share screen,0
844,support umbau port,2
845,type outage network circuit power please specify top cert site yes start schedule maintenance company provider maint ticket backup active contact notify phone email remote dial equipment reset verify work vendor global telecom verizon gsc start additional diagnostic,1
846,hello monitor ahmet materiallager cause problem please take look,2
847,job fail scheduler,4
848,blank call,0
849,hostname since server reboot daily today reboot still srirgrtyam inform,3
850,problem outlook,2
851,unable load collaboration platform,0
852,hello team please install analysis office clrgtydia since version set hana sid connection present compatible issue sev well,4
853,user able see text mail iphone,0
854,job fail scheduler,4
855,ticket update inplant,0
856,job bkbackup tool sql prod full fail scheduler,1
857,hostname report engineering tooling production windows disk space utilization alert free less,3
858,dsw incident overview see vid microsoft windows httpsys rce vulnerability exploit attempt cve mapp alert generate isensplant company com device indicate one host include attempt http sys remote code execution internet face successful exploitation result denial service condition vulnerable system escalate via high severity full escalation master ticket unblocked event relate create singular inbound threat effectively serve receive feedback handle go forward note block source address necessarily productive due attacker ability switch address use proxy anonymize software tor vpns please investigate environment determine whether run version application target ensure recent non device patch properly harden attack would like handle differently let know either correspond delegate back soc call number option available handle future autoresolve kernel driver directly portal explicit notification reporting purpose likely good choice medium priority phone call unique generate relatively large volume ticket,3
859,type outage network circuit power please specify top cert site yes start schedule maintenance company provider maint ticket backup active contact notify phone email remote dial equipment reset verify work vendor global telecom verizon gsc start additional diagnostic,1
860,volume label sys amssm server space consume available,3
861,occurence people get user authentication fail error tortm hortl howthrelte yqxlbswt eimhxowu tnhymatj unresolved ligsnzur smcxerwk grargtfl could please check root cause unlock operator password log mii report production lee able get password management tool try min see work other verify active directory try help tony minute resolve issue end shift,0
862,require additional memory drive server hostname please check attachment,3
863,job tool netch keheu fail scheduler,1
864,able login window,0
865,contact need read write access folder ldgm lean network path hostname public,3
866,type outage network circuit power please specify top cert site yes start schedule maintenance company provider maint ticket backup active contact notify phone email remote dial equipment reset verify work vendor global telecom verizon gsc start additional diagnostic,1
867,job snp heu regen fail scheduler,1
868,observe alert monitoring tool since shop floor app report status lcosm able ping server user karansb ping company com byte datum reply time ttl statistic packet send receive lose loss approximate round trip times milli second minimum maximum average,3
869,install win ewew,2
870,job fail scheduler,4
871,hello marfhtyio activation srgtycha clear rd please activate bxgwyamr hjbukvcq personalnr well thank advance mfg reinhard send wednesday regard access right would like approval greeting kind regard well,3
872,set printer cvd der,2
873,install kis ewew guvgytniak,2
874,gdhyrts muggftyali sadghryioshkurtyar hiremath stefyty parkeyhrt low disk space lhqsid drive nagfghtyudra sadghryiosh check access tomorrow dot net application deployment realize run free request help clear temporary file add need approval move drive require,3
875,can not open excel file hostname department hrm price current slow freeze,3
876,vendor create report usa carve unable save local use erp gui solution must provide immediately soon delay project description form vvgtybyrn run need unconverted text open excel make formatheywting change send team lead run uacyltoe hxgaycze programdnty attach transaction can not machine try thumb drive also unsuccessful somewhere network someone format another idea accomplish would great,3
877,name betshdy language browser microsoft internet explorer customer number telephone summary can not get collaboration platform open sit spin,0
878,outlook work crm issue,0
879,hostname volume consume,3
880,job sid hotf fail scheduler,1
881,iom sensor chassis internal power supply report non critical alert could please investigate advise,3
882,type outage network circuit power please specify top cert site slo min yes start schedule maintenance company provider maint ticket backup active contact notify phone email remote dial equipment reset verify work vendor global telecom verizon gsc start additional diagnostic,1
883,dsw incident overview detect least occurrence firewall company internal asa com drop traffic source hostname destine port one destination device activity indicate follow infection host misconfigure scan authorize unauthorized,3
884,job fail scheduler,4
885,job conf fail scheduler,4
886,lean tracker working,0
887,job fail scheduler,4
888,please assist change windows password expire log erp username bragtydlc employee aerp,0
889,windows account lockout,0
890,swap printer gogtyek,2
891,job zscr wkly rollfgyuej fail scheduler,1
892,usb verl ngerungskabel liefern,2
893,job fail scheduler,1
894,remappe,0
895,sign error lync,2
896,job fail scheduler,1
897,type outage network circuit power please specify top cert site yes start schedule maintenance company provider maint ticket backup active contact notify phone email remote dial equipment reset verify work vendor global telecom verizon gsc start additional diagnostic,1
898,windows disk space utilization alert hostname,3
899,timnhyt rehtyulds datacenter dacl cold backup,1
900,setup new,2
901,mobile device activation,0
902,name employee need access wdwddw wwdyuan yqddquanw number file locate operation drive sub draft itar set guy lay,3
903,hostname status label dat ebcd utilize,3
904,access datum server proceed customer order,3
905,job fail scheduler,4
906,receive report tool alert hostname company com connect,1
907,abende job scheduler,4
908,usa backup exec server rgtsm file raid hdd physical disk,3
909,problem erpgui ewewx,2
910,hostname oracle finance app financial management web tier epmsystem service monitor unknown java server,3
911,hostname epmsystem exe wrong number instance process expect find,3
912,job bwhrattr fail scheduler,4
913,critical lhqsid company com time ipc failure read net message read error system connection reset peer abort backup statistic session queue hour complete disk agent fail abort total medium mbyte use agent error job scheduler,1
914,hostname respond since,3
915,tool unable connect server time recording work instal user telefon,2
916,unable reach destination server offline,3
917,job fail scheduler,4
918,reset password,3
919,domain account lock,0
920,setup new batuhan gueduel,2
921,quick reactivate account laptop ewel,2
922,problem,2
923,password expire please reset iphone,2
924,receive call music play one answer interaction,0
925,user issue login new password connect system use teamviewer help company vpn sync network outlook skype issue resolve,0
926,type outage network circuit power please specify top cert site yes start schedule maintenance company provider maint ticket backup active contact notify phone email remote dial equipment reset verify work vendor global telecom verizon gsc start additional diagnostic,1
927,able submit lean tracker collaboration platform,0
928,job bwhrattr fail scheduler,4
929,team mss access miss need raise job requisition please help fix tiffrtany tafgtyng manager share services asia pacific select follow link view disclaimer alternate language,0
930,password reset use management tool,0
931,problem information stand ewew,2
932,need email address login outlook,0
933,please get user nuerthytzg access folder location hostname team globalengservice tcb file warm,3
934,install win ewew,2
935,job fail scheduler,3
936,install win ewew,2
937,job bwsdslspln fail scheduler,4
938,extract file request use rscrm bapi,4
939,job fail scheduler,1
940,job fail scheduler,4
941,type outage network circuit power please specify top cert site yes start schedule maintenance company provider maint ticket backup active contact notify phone email remote dial equipment reset verify work vendor global telecom verizon gsc start additional diagnostic,1
942,impact award login issue,0
943,job fail scheduler,4
944,need setup exchange corporate iphone,0
945,job fail scheduler,4
946,login kas company com try start tess app receive error message contact designes scandinavia fortive please needful,3
947,setuplaptop sandstrahlger und roboworker,2
948,hostname currently experience high cpu utilization please investigate,3
949,windows password reset,0
950,job tool netch fail scheduler,1
951,abende job scheduler,1
952,hello computer shift foreman gabryl tk byczkowski stankewitz defective please come,2
953,setup new,2
954,setup new strahlraum,2
955,microsoft word stop work unable open file,0
956,outlook continuously ask password,0
957,export contact outlook,0
958,tool ewew work,2
959,hello team one company user sometimes error message think erp server connection issue solution show happen access stop xmgptwho fmcxikqz takeshi asano,4
960,critical lhqsid company com time ipc failure read net message read error system connection reset peer abort job fail scheduler,1
961,job fail scheduler,4
962,hello let know process install start access official mail smart phone detail make oppo build number xex imei duel sim mobile need,0
963,help desk please usa access right hpmjtgik blrmfvyh follow folder hostname department finance new staff japan department reportncqulao qauighdpnag good,3
964,please provide read write access follow folder drive coating data base database production day wise month computer name user detail per list slno system number awyw awysinic sbfhydeep kurtyar grind operation,3
965,job fail scheduler,4
966,dear colleague virtual server germany move hostname vrtx system urgently miss fileserver efdsm printserver server team would please kind start many,3
967,abende job scheduler,4
968,unable access hostname,3
969,sample refresh well,4
970,please help provide access hostname department follow financemssg apac partner ctc person lxkecjgr fwknxupq fjzywdpg vkdobexr tnorudbf lauftqmd rtr qcjevayr xirwgjks nil madhaw rai uyocgasl ogabwxzv nfdtriwx lriupqct level full control,3
971,type outage network circuit power please specify top cert site yes start schedule maintenance company provider maint ticket backup active contact notify phone email remote dial equipment reset verify work vendor global telecom verizon gsc start additional diagnostic,1
972,job fail scheduler,4
973,setup new strahlraum fyedqgzt jdqvuhlr,2
974,hostname volume consume currently space available,3
975,emea israel company isr mainswitch access since,1
976,india high latency packet drop,1
977,hostname volume label dat deb server space consume available,3
978,job fail scheduler,4
979,job tool netch fail scheduler,1
980,need common place online storage complete machine assembly model one presently drawing individual designer pcs retrieval difficult day machine design datum handle go control separate drive administrative save view periodic back archive store,3
981,user virakv ping awysv ping company com byte datum request time statistic packet send receive lose loss,3
982,give error message login network register setting operation complete wait moment,2
983,job fail scheduler,1
984,job fail scheduler,4
985,job fail scheduler,1
986,setup calculator ewew,2
987,user profile seem messed server create try investigate monitoring tool issue come across error message attach screenshot please,3
988,job sid arc fail scheduler,1
989,job fail scheduler,4
990,hello helpdesk able connect vpn home office couple hour ago connect work anymore get message session expire click link nothing happen need help dynamics crm chat live agent regard question well,0
991,erp sid password reset,0
992,job fail scheduler,4
993,problem portal,2
994,job fail scheduler,1
995,job fail scheduler,1
996,need get crm load outlook currently use web version metalworke sale engineer company inc technical support,0
997,mithyke tayjuoylor arithel shfsako get error try open add lean event button pcs,0
998,outlook issue yesterday take hour load afterit slow today open anymore please check,0
999,job fail scheduler,4
1000,unable get audio skype meeting,0
1001,job fail scheduler,1
1002,job fail scheduler,4
1003,job fail scheduler,1
1004,hostname average sample disk free warning threshold total size,3
1005,please provide detail template multiple application impact use quick ticket operation folder site location germany user system see performance problem list crm erp bobj transaction slow create order sid take second build page area belong sale finance markhtyete etc issue replicate support group user attach relevant screenshot exact time occur,0
1006,please reset supply chain software password,0
1007,setup new,2
1008,hello next one month bedord usa request provide access drive ldbsm engineering application since take much time open document tool current path hostname kindly process aerp,3
1009,account lock window,0
1010,account lock summary computer,0
1011,job fail scheduler,4
1012,abende job scheduler,1
1013,dear hana report refresh help check specialist accounting reporting,4
1014,outlook work,0
1015,blade chassis hostname report non critical hardware issue team new functionality feature monitor tool provide start monitorixepyfbga wtqdyoinware sensor receive alert iom sensor turn could please investigate advise,3
1016,contact,0
1017,pick old equipment cad monitor,2
1018,inquiry lotus note,0
1019,node lhqsv locate usa since interface sandplant sandir,1
1020,abende job scheduler,4
1021,please switch configure printer,2
1022,job fail scheduler,1
1023,lhqsm fim production miiserver exe wrong number instance process expect gte find,3
1024,company chn apac access mandc new plant location sicne,1
1025,job sid arc fail scheduler,1
1026,abende job scheduler bkbackup tool report prod inc,1
1027,"access iphone probably block account again , password reset",2
1028,job sid arc fail scheduler,1
1029,abende job scheduler,4
1030,job tool netch keheu fail scheduler,1
1031,support,2
1032,type outage network circuit power please specify top cert site yes start est schedule maintenance company provider maint ticket backup active contact notify phone email remote dial equipment reset verify work vendor global telecom verizon gsc start additional diagnostic,1
1033,want give utislgov fetaqndw access hostname department drive,3
1034,support umbau ewew,2
1035,job hostname fail fail scheduler,1
1036,vmware tool run server hostname reside host backup job fail,3
1037,"hello colleague , please explain colleague diehm ask question , click can not log in , thank gru cid hardcopy",0
1038,new team manager detail update bobj report ess open bex refer screenshot still show old datum need reflect already erp phone sartlgeo lhqksbdx,4
1039,machine stick welcome screen,0
1040,job fail scheduler,1
1041,abende job scheduler,1
1042,hostname corporate file server team production inactive,3
1043,job fail scheduler,1
1044,"hello everyone log password management tool manager , account block please activate valid registration sure use good",0
1045,large zip file want download add folder hostname intellectual property unzip try save say enough space lryturhyyth ryhunan chief counsel,3
1046,unfortunately can not log computer . error message . relationship trust workstation prim ren dom could establish,2
1047,erp excel add issue,4
1048,usa file server hostname fail hard drive,3
1049,outlook work,0
1050,job bwhrattr fail scheduler,4
